{
  "schema_version": 1,
  "id": "files",
  "description": "Optional Syncthing for explicitly paired personal devices and selected folders.",
  "services": ["syncthing"],
  "requires": [],
  "access": [{"service": "syncthing", "title": "Files", "https_port": 8452, "scheme": "http", "path": "/", "auth": "application GUI account required; device pairing is a separate operation"}],
  "state": [{"service": "syncthing", "target": "/var/syncthing", "kind": "essential", "consistency": "stop"}],
  "secrets": []
}
