{
  "schema_version": 1,
  "id": "home",
  "description": "Optional Home Assistant Container for a selected local device and automation.",
  "services": ["home-assistant"],
  "requires": [],
  "access": [{"service": "home-assistant", "title": "Home Assistant", "https_port": 8451, "scheme": "http", "path": "/", "auth": "application account required; enroll privately and configure the observed reverse proxy"}],
  "state": [{"service": "home-assistant", "target": "/config", "kind": "essential", "consistency": "stop"}],
  "secrets": []
}
